[
  {
    "id": "monsters/act5.barbarian-savage",
    "name": "Barbarian Savage",
    "life": [
      200,
      280
    ],
    "lifeGrowth": [
      20,
      28
    ],
    "skills": [
      "monster-strong-melee"
    ],
    "attackSpeed": 100,
    "defense": 40,
    "resistances": {
      "physical": 25
    },
    "baseExperience": 10,
    "canBeElite": true,
    "canBeBoss": false,
    "eliteAffixes": [
      "extra-fast",
      "extra-strong",
      "cursed",
      "fire-enchanted",
      "cold-enchanted",
      "lightning-enchanted",
      "mana-burn",
      "spectral-hit",
      "stone-skin",
      "teleportation"
    ]
  },
  {
    "id": "monsters/act5.death-mauler",
    "name": "Death Mauler",
    "life": [
      350,
      500
    ],
    "lifeGrowth": [
      35,
      50
    ],
    "skills": [
      "monster-strong-melee",
      "monster-leap-attack"
    ],
    "attackSpeed": 110,
    "defense": 65,
    "resistances": {
      "physical": 50
    },
    "baseExperience": 25,
    "canBeElite": true,
    "canBeBoss": false,
    "eliteAffixes": [
      "extra-fast",
      "extra-strong",
      "cursed",
      "fire-enchanted",
      "cold-enchanted",
      "lightning-enchanted",
      "mana-burn",
      "spectral-hit",
      "stone-skin",
      "teleportation"
    ]
  },
  {
    "id": "monsters/act5.overseer",
    "name": "Overseer",
    "life": [
      300,
      450
    ],
    "lifeGrowth": [
      30,
      45
    ],
    "skills": [
      "monster-strong-melee",
      "monster-war-cry"
    ],
    "attackSpeed": 105,
    "defense": 60,
    "resistances": {
      "fire": 25,
      "cold": 25,
      "lightning": 25,
      "poison": 25,
      "arcane": 25
    },
    "baseExperience": 25,
    "canBeElite": true,
    "canBeBoss": false,
    "eliteAffixes": [
      "extra-fast",
      "extra-strong",
      "cursed",
      "fire-enchanted",
      "cold-enchanted",
      "lightning-enchanted",
      "mana-burn",
      "spectral-hit",
      "stone-skin",
      "teleportation"
    ]
  },
  {
    "id": "monsters/act5.blood-lord",
    "name": "Blood Lord",
    "life": [
      500,
      700
    ],
    "lifeGrowth": [
      50,
      70
    ],
    "skills": [
      "monster-strong-melee",
      "monster-fire-breath"
    ],
    "attackSpeed": 110,
    "defense": 90,
    "resistances": {
      "fire": 75
    },
    "baseExperience": 50,
    "canBeElite": true,
    "canBeBoss": false,
    "eliteAffixes": [
      "extra-fast",
      "extra-strong",
      "cursed",
      "fire-enchanted",
      "cold-enchanted",
      "lightning-enchanted",
      "mana-burn",
      "spectral-hit",
      "stone-skin",
      "teleportation"
    ]
  },
  {
    "id": "monsters/act5.warped-shaman",
    "name": "Warped Shaman",
    "life": [
      280,
      400
    ],
    "lifeGrowth": [
      28,
      40
    ],
    "skills": [
      "monster-frost-nova",
      "monster-summon-adds"
    ],
    "attackSpeed": 95,
    "defense": 50,
    "resistances": {
      "cold": 50
    },
    "baseExperience": 25,
    "canBeElite": true,
    "canBeBoss": false,
    "eliteAffixes": [
      "extra-fast",
      "extra-strong",
      "cursed",
      "fire-enchanted",
      "cold-enchanted",
      "lightning-enchanted",
      "mana-burn",
      "spectral-hit",
      "stone-skin",
      "teleportation"
    ]
  },
  {
    "id": "monsters/act5.succubus",
    "name": "Succubus",
    "life": [
      320,
      480
    ],
    "lifeGrowth": [
      32,
      48
    ],
    "skills": [
      "monster-arcane-bolt",
      "monster-curse"
    ],
    "attackSpeed": 115,
    "defense": 55,
    "resistances": {
      "arcane": 50
    },
    "baseExperience": 25,
    "canBeElite": true,
    "canBeBoss": false,
    "eliteAffixes": [
      "extra-fast",
      "extra-strong",
      "cursed",
      "fire-enchanted",
      "cold-enchanted",
      "lightning-enchanted",
      "mana-burn",
      "spectral-hit",
      "stone-skin",
      "teleportation"
    ]
  },
  {
    "id": "monsters/act5.frozen-terror",
    "name": "Frozen Terror",
    "life": [
      550,
      800
    ],
    "lifeGrowth": [
      55,
      80
    ],
    "skills": [
      "monster-strong-melee",
      "monster-frost-aura"
    ],
    "attackSpeed": 110,
    "defense": 95,
    "resistances": {
      "cold": 75
    },
    "baseExperience": 50,
    "canBeElite": true,
    "canBeBoss": false,
    "eliteAffixes": [
      "extra-fast",
      "extra-strong",
      "cursed",
      "fire-enchanted",
      "cold-enchanted",
      "lightning-enchanted",
      "mana-burn",
      "spectral-hit",
      "stone-skin",
      "teleportation"
    ]
  },
  {
    "id": "monsters/act5.ancient-barbarian",
    "name": "Ancient Barbarian",
    "life": [
      3000,
      4000
    ],
    "lifeGrowth": [
      250,
      300
    ],
    "skills": [
      "monster-strong-melee",
      "monster-whirlwind",
      "monster-shout"
    ],
    "attackSpeed": 130,
    "defense": 200,
    "resistances": {
      "physical": 50,
      "fire": 25,
      "cold": 25,
      "lightning": 25,
      "poison": 25,
      "arcane": 25
    },
    "baseExperience": 2000,
    "canBeElite": false,
    "canBeBoss": true
  },
  {
    "id": "monsters/act5.baal-minion",
    "name": "Baal's Minion",
    "life": [
      600,
      900
    ],
    "lifeGrowth": [
      60,
      90
    ],
    "skills": [
      "monster-strong-melee",
      "monster-fire-breath",
      "monster-poison-cloud"
    ],
    "attackSpeed": 115,
    "defense": 100,
    "resistances": {
      "fire": 50,
      "poison": 50
    },
    "baseExperience": 50,
    "canBeElite": true,
    "canBeBoss": false,
    "eliteAffixes": [
      "extra-fast",
      "extra-strong",
      "cursed",
      "fire-enchanted",
      "cold-enchanted",
      "lightning-enchanted",
      "mana-burn",
      "spectral-hit",
      "stone-skin",
      "teleportation"
    ]
  },
  {
    "id": "monsters/act5.baal",
    "name": "Baal",
    "life": [
      8000,
      10000
    ],
    "lifeGrowth": [
      500,
      700
    ],
    "skills": [
      "monster-frost-nova",
      "monster-inferno",
      "monster-mana-rift",
      "monster-tentacles"
    ],
    "attackSpeed": 150,
    "defense": 350,
    "resistances": {
      "fire": 75,
      "cold": 75,
      "lightning": 75,
      "poison": 75,
      "arcane": 75
    },
    "baseExperience": 5000,
    "canBeElite": false,
    "canBeBoss": true
  }
]
